{"$schema":"https://json-schema.org/draft/2020-12/schema","$id":"https://memory-os.example/schemas/memory-town/landscape-v1-projection-case.v1.schema.json","title":"Memory Town Landscape v1 Projection Compatibility Case v1","type":"object","additionalProperties":false,"required":["$schema","caseId","caseVersion","sourceFixtureRefs","mappingRules","assertions","forbiddenPersistedFields"],"properties":{"$schema":{"const":"https://memory-os.example/schemas/memory-town/landscape-v1-projection-case.v1.schema.json"},"caseId":{"$ref":"core.v1.schema.json#/$defs/StableId"},"caseVersion":{"$ref":"core.v1.schema.json#/$defs/PositiveInteger"},"sourceFixtureRefs":{"type":"object","additionalProperties":false,"required":["terrain","linearFeatures"],"properties":{"terrain":{"type":"string","minLength":1,"maxLength":256},"linearFeatures":{"type":"string","minLength":1,"maxLength":256}}},"mappingRules":{"type":"object","additionalProperties":false,"required":["terrainKindToV1","pathKindToV1","derivedProjectionNotCanonical"],"properties":{"terrainKindToV1":{"type":"object","additionalProperties":false,"required":["grass","soil","sand","stone","forest_floor","plaza","shallow_water","marsh"],"properties":{"grass":{"enum":["grass","soil","sand","stone","coast","water"]},"soil":{"enum":["grass","soil","sand","stone","coast","water"]},"sand":{"enum":["grass","soil","sand","stone","coast","water"]},"stone":{"enum":["grass","soil","sand","stone","coast","water"]},"forest_floor":{"enum":["grass","soil","sand","stone","coast","water"]},"plaza":{"enum":["grass","soil","sand","stone","coast","water"]},"shallow_water":{"enum":["grass","soil","sand","stone","coast","water"]},"marsh":{"enum":["grass","soil","sand","stone","coast","water"]}}},"pathKindToV1":{"type":"object","additionalProperties":false,"required":["road","footpath","promenade","boardwalk","plaza_link"],"properties":{"road":{"enum":["road","footpath","plaza","bridge"]},"footpath":{"enum":["road","footpath","plaza","bridge"]},"promenade":{"enum":["road","footpath","plaza","bridge"]},"boardwalk":{"enum":["road","footpath","plaza","bridge"]},"plaza_link":{"enum":["road","footpath","plaza","bridge"]}}},"derivedProjectionNotCanonical":{"const":true}}},"assertions":{"type":"object","additionalProperties":false,"required":["terrain","paths"],"properties":{"terrain":{"type":"array","minItems":1,"maxItems":10000,"items":{"$ref":"#/$defs/TerrainAssertion"}},"paths":{"type":"array","minItems":1,"maxItems":10000,"items":{"$ref":"#/$defs/PathAssertion"}}}},"forbiddenPersistedFields":{"const":["connectionMask","coastlineMask","riverbankMask","derivedSpriteId"]}},"$defs":{"TerrainAssertion":{"type":"object","additionalProperties":false,"required":["position","sourceTerrainRegionId","expectedV1Kind"],"properties":{"position":{"$ref":"core.v1.schema.json#/$defs/TownGridPosition"},"sourceTerrainRegionId":{"$ref":"core.v1.schema.json#/$defs/StableId"},"expectedV1Kind":{"enum":["grass","soil","sand","stone","coast","water"]}}},"PathAssertion":{"type":"object","additionalProperties":false,"required":["position","sourcePathFeatureId","expectedV1PathType","connectionMaskDerived"],"properties":{"position":{"$ref":"core.v1.schema.json#/$defs/TownGridPosition"},"sourcePathFeatureId":{"$ref":"core.v1.schema.json#/$defs/StableId"},"expectedV1PathType":{"enum":["road","footpath","plaza","bridge"]},"connectionMaskDerived":{"const":true}}}}}
