{"$schema":"https://memory-os.example/schemas/memory-town/landscape-v1-projection-case.v1.schema.json","caseId":"memory-town.landscape-v1-projection.round7","caseVersion":1,"sourceFixtureRefs":{"terrain":"terrain-region-state.round7.valid.v1.json","linearFeatures":"linear-feature-graph.round7.valid.v1.json"},"mappingRules":{"terrainKindToV1":{"grass":"grass","soil":"soil","sand":"sand","stone":"stone","forest_floor":"grass","plaza":"stone","shallow_water":"water","marsh":"water"},"pathKindToV1":{"road":"road","footpath":"footpath","promenade":"footpath","boardwalk":"footpath","plaza_link":"plaza"},"derivedProjectionNotCanonical":true},"assertions":{"terrain":[{"position":{"cellX":0,"cellY":0,"elevationLevel":0},"sourceTerrainRegionId":"terrain.central.grass","expectedV1Kind":"grass"},{"position":{"cellX":3,"cellY":1,"elevationLevel":0},"sourceTerrainRegionId":"terrain.central.plaza","expectedV1Kind":"stone"},{"position":{"cellX":3,"cellY":6,"elevationLevel":0},"sourceTerrainRegionId":"terrain.coast.sand","expectedV1Kind":"sand"},{"position":{"cellX":3,"cellY":8,"elevationLevel":0},"sourceTerrainRegionId":"terrain.coast.shallow","expectedV1Kind":"water"}],"paths":[{"position":{"cellX":1,"cellY":3,"elevationLevel":0},"sourcePathFeatureId":"path.main.harbor","expectedV1PathType":"road","connectionMaskDerived":true},{"position":{"cellX":2,"cellY":3,"elevationLevel":0},"sourcePathFeatureId":"path.main.harbor","expectedV1PathType":"bridge","connectionMaskDerived":true},{"position":{"cellX":4,"cellY":5,"elevationLevel":0},"sourcePathFeatureId":"path.main.harbor","expectedV1PathType":"road","connectionMaskDerived":true}]},"forbiddenPersistedFields":["connectionMask","coastlineMask","riverbankMask","derivedSpriteId"]}
